{
  "vectorId": "schedules.year-boundary",
  "vectorVersion": 1,
  "profile": "scheduler-reliability",
  "category": "schedules",
  "title": "A tick after New Year fences the January slot; December is collapsed by misfire-latest",
  "deterministic": true,
  "artifacts": ["coven.automations.occurrence.v1"],
  "specRefs": ["coven#816"],
  "virtualTime": { "start": "2026-12-31T00:00:00.000Z" },
  "input": {
    "definitions": [
      {
        "schemaVersion": 1, "id": "daily", "name": "Daily", "status": "ACTIVE",
        "rrule": "FREQ=DAILY;BYHOUR=9", "timezone": "utc", "misfire": "latest", "overlap": "forbid",
        "timeoutMinutes": 30, "runtime": "coven-code", "cwd": "work/proj", "prompt": "Run the routine."
      }
    ],
    "operations": [{ "op": "tick", "at": "2027-01-01T10:00:00.000Z" }]
  },
  "expected": {
    "occurrences": [
      { "automationId": "daily", "scheduledFor": "2027-01-01T09:00:00.000Z", "state": "succeeded" }
    ],
    "dispatchCount": 1
  }
}
