{
  "vectorId": "state-machines.run-terminal-monotonicity",
  "vectorVersion": 1,
  "profile": "scheduler-reliability",
  "category": "state-machines",
  "title": "A duplicate or late terminal callback is a no-op: one settlement, one dispatch",
  "deterministic": true,
  "artifacts": ["coven.automations.run.v1"],
  "specRefs": ["coven#855", "coven#856"],
  "virtualTime": { "start": "2026-03-01T00:00:00.000Z" },
  "input": {
    "definitions": [
      {
        "schemaVersion": 1, "id": "daily", "name": "Daily", "status": "ACTIVE",
        "rrule": "FREQ=DAILY;BYHOUR=9", "timezone": "utc", "misfire": "latest", "overlap": "forbid",
        "timeoutMinutes": 30, "runtime": "coven-code", "cwd": "work/proj", "prompt": "Run the routine."
      }
    ],
    "operations": [
      { "op": "runtimeBehavior", "behavior": "duplicate-response" },
      { "op": "tick", "at": "2026-03-01T10:00:00.000Z" }
    ]
  },
  "expected": {
    "occurrences": [{ "automationId": "daily", "state": "succeeded" }],
    "runs": [{ "automationId": "daily", "status": "succeeded", "count": 1 }],
    "dispatchCount": 1,
    "invariants": ["terminal-state-monotonicity", "no-duplicate-dispatch-per-fence", "no-false-success-under-injected-failure"]
  }
}
