{
  "vectorId": "privacy.erasure-tombstone",
  "vectorVersion": 1,
  "profile": "privacy",
  "category": "privacy",
  "title": "Erasure tombstones the routine: the prompt is unrecoverable from any surface while the object id survives",
  "deterministic": true,
  "artifacts": ["diagnostics.doctor.v1", "coven.automations.event.v1"],
  "specRefs": ["coven#858"],
  "virtualTime": { "start": "2026-03-01T00:00:00.000Z" },
  "input": {
    "definitions": [
      {
        "schemaVersion": 1, "id": "daily", "name": "Daily", "status": "ACTIVE",
        "rrule": "FREQ=DAILY;BYHOUR=9", "timezone": "utc", "misfire": "latest", "overlap": "forbid",
        "timeoutMinutes": 30, "runtime": "coven-code", "cwd": "work/proj",
        "prompt": "Summarize the private family calendar."
      }
    ],
    "operations": [
      { "op": "tick", "at": "2026-03-01T10:00:00.000Z" },
      { "op": "erase", "automationId": "daily", "at": "2026-03-01T11:00:00.000Z" },
      { "op": "tick", "at": "2026-03-01T11:05:00.000Z" }
    ]
  },
  "expected": {
    "redaction": {
      "forbiddenSubstrings": ["private family calendar"]
    },
    "events": [{ "type": "definition.tombstoned", "count": 1 }]
  }
}
