{
  "vectorId": "idempotency.stale-definition-update",
  "vectorVersion": 1,
  "profile": "scheduler-reliability",
  "category": "idempotency",
  "title": "A stale client update against a newer definition revision is refused",
  "deterministic": true,
  "artifacts": ["coven.automations.definition.v1"],
  "specRefs": ["coven#855"],
  "virtualTime": { "start": "2026-03-01T00:00:00.000Z" },
  "input": {
    "definitions": [
      {
        "schemaVersion": 1, "id": "daily", "name": "Daily", "status": "ACTIVE",
        "rrule": "FREQ=DAILY;BYHOUR=9", "timezone": "utc", "misfire": "latest", "overlap": "forbid",
        "timeoutMinutes": 30, "runtime": "coven-code", "cwd": "work/proj", "prompt": "Run the routine."
      }
    ],
    "operations": [
      { "op": "setDefinitionRevision", "automationId": "daily", "revision": 2, "label": "bump" },
      { "op": "setDefinitionRevision", "automationId": "daily", "revision": 1, "label": "stale" }
    ]
  },
  "expected": {
    "refusals": [
      { "refusalId": "stale", "reasonMatches": "stale definition update" }
    ]
  }
}
