{
  "vectorId": "authority.approval-replayed-refused",
  "vectorVersion": 1,
  "profile": "runtime-authority",
  "category": "identity-authority",
  "title": "Nonce replay is refused: an approval authorizes exactly one run",
  "deterministic": true,
  "artifacts": [
    "coven.automations.authority.v1"
  ],
  "specRefs": [
    "coven#857"
  ],
  "virtualTime": {
    "start": "2026-03-01T00:00:00.000Z"
  },
  "input": {
    "definitions": [
      {
        "schemaVersion": 1,
        "id": "daily",
        "name": "Daily",
        "status": "ACTIVE",
        "rrule": "FREQ=DAILY;BYHOUR=9",
        "timezone": "utc",
        "misfire": "latest",
        "overlap": "forbid",
        "timeoutMinutes": 30,
        "runtime": "coven-code",
        "cwd": "work/proj",
        "prompt": "Run the routine."
      }
    ],
    "bindings": [
      {
        "automationId": "daily",
        "principalId": "principal-1",
        "familiarId": "charm",
        "familiarRevision": 1,
        "runtime": "coven-code",
        "requiredCapabilities": [
          "session.create"
        ],
        "approval": {
          "required": true,
          "nonce": "n1",
          "ttlMinutes": 120
        }
      }
    ],
    "operations": [
      {
        "op": "grantApproval",
        "automationId": "daily",
        "nonce": "n1",
        "ttlMinutes": 120,
        "at": "2026-03-01T09:55:00.000Z"
      },
      {
        "op": "runNow",
        "automationId": "daily",
        "adoptionKey": "first",
        "at": "2026-03-01T10:00:00.000Z"
      },
      {
        "op": "runNow",
        "automationId": "daily",
        "adoptionKey": "second",
        "at": "2026-03-01T10:10:00.000Z"
      }
    ]
  },
  "expected": {
    "runs": [
      {
        "automationId": "daily",
        "status": "succeeded",
        "count": 1
      }
    ],
    "occurrences": [
      {
        "automationId": "daily",
        "scheduledFor": "2026-03-01T10:10:00.000Z",
        "state": "failed",
        "failureReasonMatches": "approval replayed"
      }
    ],
    "dispatchCount": 1
  }
}
