{
  "vectorId": "idempotency.run-now-adoption-replay",
  "vectorVersion": 1,
  "profile": "scheduler-reliability",
  "category": "idempotency",
  "title": "A duplicate manual command with one adoption key runs once; the replay is refused idempotently",
  "deterministic": true,
  "artifacts": ["coven.automations.run.v1"],
  "specRefs": ["coven#855"],
  "virtualTime": { "start": "2026-03-01T00:00:00.000Z" },
  "input": {
    "definitions": [
      {
        "schemaVersion": 1, "id": "daily", "name": "Daily", "status": "ACTIVE",
        "rrule": "FREQ=DAILY;BYHOUR=9", "timezone": "utc", "misfire": "latest", "overlap": "forbid",
        "timeoutMinutes": 30, "runtime": "coven-code", "cwd": "work/proj", "prompt": "Run the routine."
      }
    ],
    "operations": [
      { "op": "runNow", "automationId": "daily", "adoptionKey": "request-1", "label": "first", "at": "2026-03-01T10:00:00.000Z" },
      { "op": "runNow", "automationId": "daily", "adoptionKey": "request-1", "label": "replay", "at": "2026-03-01T10:00:01.000Z" }
    ]
  },
  "expected": {
    "occurrences": [{ "automationId": "daily", "state": "succeeded" }],
    "runs": [{ "automationId": "daily", "status": "succeeded", "count": 1 }],
    "dispatchCount": 1,
    "refusals": [
      { "refusalId": "replay", "reasonMatches": "adoption key already consumed" }
    ]
  }
}
