{
  "vectorId": "schedules.suspend-resume",
  "vectorVersion": 1,
  "profile": "scheduler-reliability",
  "category": "schedules",
  "title": "Host suspend across five days resumes with exactly one fenced occurrence",
  "deterministic": true,
  "artifacts": ["coven.automations.occurrence.v1"],
  "specRefs": ["coven#856"],
  "virtualTime": { "start": "2026-03-01T00:00:00.000Z" },
  "input": {
    "definitions": [
      {
        "schemaVersion": 1, "id": "daily", "name": "Daily", "status": "ACTIVE",
        "rrule": "FREQ=DAILY;BYHOUR=9", "timezone": "utc", "misfire": "latest", "overlap": "forbid",
        "timeoutMinutes": 30, "runtime": "coven-code", "cwd": "work/proj", "prompt": "Run the routine."
      }
    ],
    "operations": [
      { "op": "suspend", "at": "2026-03-06T12:00:00.000Z" },
      { "op": "resume", "at": "2026-03-06T12:00:00.000Z" },
      { "op": "tick", "at": "2026-03-06T12:00:00.000Z" }
    ]
  },
  "expected": {
    "occurrences": [
      { "automationId": "daily", "scheduledFor": "2026-03-06T09:00:00.000Z", "state": "succeeded" }
    ],
    "dispatchCount": 1
  }
}
