{
  "vectorId": "golden.17-runtime-capability-downgrade",
  "vectorVersion": 1,
  "profile": "runtime-authority",
  "category": "scenario",
  "title": "Golden 17: a runtime capability downgrade refuses dispatch with the missing capability named",
  "deterministic": true,
  "artifacts": ["coven.automations.authority.v1"],
  "specRefs": ["coven#857", "coven#858"],
  "virtualTime": { "start": "2026-03-01T00:00:00.000Z" },
  "input": {
    "definitions": [
      {
        "schemaVersion": 1, "id": "routine", "name": "Routine", "status": "ACTIVE",
        "rrule": "FREQ=DAILY;BYHOUR=9", "timezone": "utc", "misfire": "latest", "overlap": "forbid",
        "timeoutMinutes": 30, "runtime": "coven-code", "cwd": "work/proj", "prompt": "Run the routine."
      }
    ],
    "bindings": [
      {
        "automationId": "routine",
        "principalId": "principal-1",
        "familiarId": "charm",
        "familiarRevision": 1,
        "runtime": "coven-code",
        "requiredCapabilities": ["session.create", "fs.write"]
      }
    ],
    "operations": [
      { "op": "setRuntimeCapabilities", "automationId": "routine", "capabilities": ["session.create"] },
      { "op": "tick", "at": "2026-03-01T10:00:00.000Z" }
    ]
  },
  "expected": {
    "occurrences": [
      { "automationId": "routine", "state": "failed", "failureReasonMatches": "capability downgrade" }
    ],
    "dispatchCount": 0
  }
}
