{
  "vectorId": "idempotency.fence-unique-two-ticks",
  "vectorVersion": 1,
  "profile": "scheduler-reliability",
  "category": "idempotency",
  "title": "Repeated ticks against one store fence each slot exactly once",
  "deterministic": true,
  "artifacts": ["coven.automations.occurrence.v1"],
  "specRefs": ["coven#816", "coven#855"],
  "virtualTime": { "start": "2026-03-01T00:00:00.000Z" },
  "input": {
    "definitions": [
      {
        "schemaVersion": 1, "id": "daily", "name": "Daily", "status": "ACTIVE",
        "rrule": "FREQ=DAILY;BYHOUR=9", "timezone": "utc", "misfire": "latest", "overlap": "forbid",
        "timeoutMinutes": 30, "runtime": "coven-code", "cwd": "work/proj", "prompt": "Run the routine."
      }
    ],
    "operations": [
      { "op": "tick", "at": "2026-03-01T10:00:00.000Z" },
      { "op": "tick", "at": "2026-03-01T10:00:00.000Z" },
      { "op": "tick", "at": "2026-03-01T11:00:00.000Z" }
    ]
  },
  "expected": {
    "occurrences": [{ "automationId": "daily", "state": "succeeded", "attempt": 1 }],
    "dispatchCount": 1,
    "invariants": ["fence-uniqueness", "no-duplicate-dispatch-per-fence"]
  }
}
