{
  "vectorId": "idempotency.ambiguous-response-no-double-dispatch",
  "vectorVersion": 1,
  "profile": "scheduler-reliability",
  "category": "idempotency",
  "title": "After an ambiguous runtime response the occurrence never re-dispatches automatically; the ambiguity is surfaced, not retried blindly",
  "deterministic": true,
  "artifacts": ["coven.automations.run.v1", "diagnostics.doctor.v1"],
  "specRefs": ["coven#856"],
  "virtualTime": { "start": "2026-03-01T00:00:00.000Z" },
  "input": {
    "definitions": [
      {
        "schemaVersion": 1, "id": "daily", "name": "Daily", "status": "ACTIVE",
        "rrule": "FREQ=DAILY;BYHOUR=9", "timezone": "utc", "misfire": "latest", "overlap": "forbid",
        "timeoutMinutes": 30, "runtime": "coven-code", "cwd": "work/proj", "prompt": "Run the routine."
      }
    ],
    "operations": [
      { "op": "runtimeBehavior", "behavior": "lost-after-side-effect" },
      { "op": "tick", "at": "2026-03-01T10:00:00.000Z" },
      { "op": "tick", "at": "2026-03-01T11:00:00.000Z" }
    ]
  },
  "expected": {
    "occurrences": [
      {
        "automationId": "daily",
        "scheduledFor": "2026-03-01T09:00:00.000Z",
        "state": "failed",
        "failureReasonMatches": "runtime lost"
      }
    ],
    "runs": [{ "automationId": "daily", "status": "failed", "ambiguous": true, "count": 1 }],
    "dispatchCount": 1,
    "doctor": { "findingCodes": ["runs.ambiguous-outcome"] },
    "invariants": ["no-duplicate-dispatch-per-fence", "no-false-success-under-injected-failure"]
  }
}
