{
  "vectorId": "authority.approval-expired-refused",
  "vectorVersion": 1,
  "profile": "runtime-authority",
  "category": "identity-authority",
  "title": "An approval past its TTL no longer authorizes dispatch",
  "deterministic": true,
  "artifacts": ["coven.automations.authority.v1"],
  "specRefs": ["coven#857"],
  "virtualTime": { "start": "2026-03-01T00:00:00.000Z" },
  "input": {
    "definitions": [
      {
        "schemaVersion": 1, "id": "daily", "name": "Daily", "status": "ACTIVE",
        "rrule": "FREQ=DAILY;BYHOUR=9", "timezone": "utc", "misfire": "latest", "overlap": "forbid",
        "timeoutMinutes": 30, "runtime": "coven-code", "cwd": "work/proj", "prompt": "Run the routine."
      }
    ],
    "bindings": [
      {
        "automationId": "daily",
        "principalId": "principal-1",
        "familiarId": "charm",
        "familiarRevision": 1,
        "runtime": "coven-code",
        "requiredCapabilities": ["session.create"],
        "approval": { "required": true, "nonce": "n1", "ttlMinutes": 5 }
      }
    ],
    "operations": [
      { "op": "grantApproval", "automationId": "daily", "nonce": "n1", "ttlMinutes": 5, "at": "2026-03-01T09:30:00.000Z" },
      { "op": "advance", "at": "2026-03-01T11:00:00.000Z" },
      { "op": "runNow", "automationId": "daily", "adoptionKey": "late", "at": "2026-03-01T11:00:00.000Z" }
    ]
  },
  "expected": {
    "occurrences": [
      { "automationId": "daily", "state": "failed", "failureReasonMatches": "approval expired" }
    ],
    "dispatchCount": 0
  }
}
