{
  "vectorId": "receipts.tamper-detected",
  "vectorVersion": 1,
  "profile": "structural",
  "category": "receipts",
  "title": "Forged lifecycle state is caught: a tampered receipt fails verification",
  "deterministic": true,
  "artifacts": ["coven.automations.receipt.v1"],
  "specRefs": ["coven#857"],
  "virtualTime": { "start": "2026-03-01T00:00:00.000Z" },
  "input": {
    "definitions": [
      {
        "schemaVersion": 1, "id": "daily", "name": "Daily", "status": "ACTIVE",
        "rrule": "FREQ=DAILY;BYHOUR=9", "timezone": "utc", "misfire": "latest", "overlap": "forbid",
        "timeoutMinutes": 30, "runtime": "coven-code", "cwd": "work/proj", "prompt": "Run the routine."
      }
    ],
    "operations": [
      { "op": "tick", "at": "2026-03-01T10:00:00.000Z" },
      { "op": "tamperReceipt" },
      { "op": "verifyReceipts" }
    ]
  },
  "expected": {
    "receipts": { "count": 1, "allVerify": false, "verifyAfterTamper": false }
  }
}
