{
  "vectorId": "schedules.clock-jump-backward",
  "vectorVersion": 1,
  "profile": "scheduler-reliability",
  "category": "schedules",
  "title": "A clock jump backward never re-fences or duplicates an already-fenced slot",
  "deterministic": true,
  "artifacts": ["coven.automations.occurrence.v1"],
  "specRefs": ["coven#856"],
  "virtualTime": { "start": "2026-03-01T00:00:00.000Z" },
  "input": {
    "definitions": [
      {
        "schemaVersion": 1, "id": "daily", "name": "Daily", "status": "ACTIVE",
        "rrule": "FREQ=DAILY;BYHOUR=9", "timezone": "utc", "misfire": "latest", "overlap": "forbid",
        "timeoutMinutes": 30, "runtime": "coven-code", "cwd": "work/proj", "prompt": "Run the routine."
      }
    ],
    "operations": [
      { "op": "tick", "at": "2026-03-01T10:00:00.000Z" },
      { "op": "advance", "at": "2026-02-28T23:00:00.000Z" },
      { "op": "tick", "at": "2026-02-28T23:00:00.000Z" }
    ]
  },
  "expected": {
    "occurrences": [
      { "automationId": "daily", "scheduledFor": "2026-03-01T09:00:00.000Z", "state": "succeeded" }
    ],
    "dispatchCount": 1,
    "invariants": ["fence-uniqueness", "no-duplicate-dispatch-per-fence"]
  }
}
