{
  "vectorId": "authority.continuity-restart-correlation",
  "vectorVersion": 1,
  "profile": "continuity",
  "category": "identity-authority",
  "title": "Crash after launch, recover on restart: occurrence, run, and changefeed keep their exact correlation; the changefeed lost the crashed pass's buffered events and says so, and no run is silently lost or wedged",
  "deterministic": true,
  "artifacts": [
    "coven.automations.authority.v1",
    "coven.automations.occurrence.v1",
    "coven.automations.run.v1",
    "coven.automations.event.v1"
  ],
  "specRefs": [
    "coven#857"
  ],
  "virtualTime": {
    "start": "2026-03-01T00:00:00.000Z"
  },
  "input": {
    "definitions": [
      {
        "schemaVersion": 1,
        "id": "daily",
        "name": "Daily",
        "status": "ACTIVE",
        "rrule": "FREQ=DAILY;BYHOUR=9",
        "timezone": "utc",
        "misfire": "latest",
        "overlap": "forbid",
        "timeoutMinutes": 30,
        "runtime": "coven-code",
        "familiarId": "charm",
        "cwd": "work/proj",
        "prompt": "Run the routine."
      }
    ],
    "bindings": [
      {
        "automationId": "daily",
        "principalId": "principal-1",
        "familiarId": "charm",
        "familiarRevision": 1,
        "runtime": "coven-code",
        "requiredCapabilities": [
          "session.create"
        ]
      }
    ],
    "operations": [
      {
        "op": "crash",
        "during": "terminal-observation"
      },
      {
        "op": "tick",
        "at": "2026-03-01T10:00:00.000Z"
      },
      {
        "op": "advance",
        "at": "2026-03-01T12:00:00.000Z"
      },
      {
        "op": "restart",
        "at": "2026-03-01T12:00:00.000Z"
      },
      {
        "op": "subscribe",
        "afterCursor": 0
      }
    ]
  },
  "expected": {
    "occurrences": [
      {
        "automationId": "daily",
        "scheduledFor": "2026-03-01T09:00:00.000Z",
        "state": "failed",
        "failureReasonMatches": "lease expired"
      }
    ],
    "runs": [
      {
        "automationId": "daily",
        "status": "failed",
        "count": 1
      }
    ],
    "dispatchCount": 1,
    "events": [
      {
        "type": "occurrence.settled",
        "count": 1
      },
      {
        "type": "run.finished",
        "count": 1
      }
    ],
    "replay": {
      "afterCursor": 0,
      "expectedEventTypes": [
        "occurrence.settled",
        "run.finished"
      ]
    },
    "doctor": {
      "findingCodes": [
        "events.cursor-lag",
        "occurrences.missed-occurrence"
      ]
    }
  }
}
