{
  "vectorId": "canary.cave-projections-truthful",
  "vectorVersion": 1,
  "profile": "interoperability",
  "category": "events",
  "title": "Cross-repo canary: Cave projections and reducers render duplicate, reconnect, and recovery states truthfully from pinned artifacts",
  "deterministic": true,
  "prerequisites": ["opencoven.cave.projections.v1@pinned"],
  "artifacts": ["coven.automations.event.v1", "opencoven.cave.projections.v1@pinned"],
  "specRefs": ["coven#858"],
  "virtualTime": { "start": "2026-03-01T00:00:00.000Z" },
  "input": {
    "definitions": [
      {
        "schemaVersion": 1, "id": "canary", "name": "Canary", "status": "ACTIVE",
        "rrule": "FREQ=DAILY;BYHOUR=9", "timezone": "utc", "misfire": "latest", "overlap": "forbid",
        "timeoutMinutes": 30, "runtime": "coven-code", "cwd": "work/proj", "prompt": "Run the canary."
      }
    ],
    "operations": [
      { "op": "tick", "at": "2026-03-01T10:00:00.000Z" },
      { "op": "subscribe", "afterCursor": 0 },
      { "op": "deliver", "afterCursor": 0, "times": 2 }
    ]
  },
  "expected": {
    "projection": {
      "eventCount": 7,
      "definition.created": 1,
      "occurrence.planned": 1,
      "occurrence.claimed": 1,
      "run.started": 1,
      "occurrence.settled": 1,
      "run.finished": 1,
      "receipt.sealed": 1
    }
  }
}
