{
  "vectorId": "diagnostics.healthy",
  "vectorVersion": 1,
  "profile": "scheduler-reliability",
  "category": "diagnostics",
  "title": "A healthy routine after a normal pass produces no findings",
  "deterministic": true,
  "artifacts": ["diagnostics.doctor.v1"],
  "specRefs": ["coven#858"],
  "virtualTime": { "start": "2026-03-01T00:00:00.000Z" },
  "input": {
    "definitions": [
      {
        "schemaVersion": 1, "id": "daily", "name": "Daily", "status": "ACTIVE",
        "rrule": "FREQ=DAILY;BYHOUR=9", "timezone": "utc", "misfire": "latest", "overlap": "forbid",
        "timeoutMinutes": 30, "runtime": "coven-code", "cwd": "work/proj", "prompt": "Run the routine."
      }
    ],
    "operations": [
      { "op": "tick", "at": "2026-03-01T10:00:00.000Z" }
    ]
  },
  "expected": {
    "doctor": { "findingCodes": [] }
  }
}
